sender,addressee,from,testo,date,lettere
Giannozzo Manetti,Vespasiano da Bisticci,Napoli,"Poiché ne' giorni passati ti scripsi del gran fragello d'uno spaventevole et inusitato tremuoto, che sabato a dì 4 di questo, di nocte, in su 11 hore, apparì in gran parte di questo paese, con tanti danni di rovine di case, di palagi, di chiese, di sobissamento di terre, di castella et di città, et con grandissima occisione d'huomini, ricevetti la tua con la 'nformatione de' gesti del nostro messer Giannozo Pandolfini. Et inteso la voglia tua et la richiesta mi fai dello scrivere oratione funebre, ti lodo et commendo della singulare affectione portasti a' costumi et alle virtù sue.

Et perch'io mi trovo in simil grado d'affectione, sono contento pigliarne la faticha dello scrivere, sì per sodisfare al debito della affectione gli portavo, sì anchora per compiacerne a te, considerando la maniera della richiesta me ne fai. Et però ho avuta chara la informatione mandatami.
Ma perché sono cose da scriverle con qualche dignità, altrimenti farebbono il contrario effecto al disegno se ne fa, vorrei m'avisassi di due cose intra l'altre: la prima, del tempo che nacque; et la seconda, del nome della donna sua; et chosì anchora se ti paresse avere lasciato indrieto cosa alchuna degna di memoria. Et incontamente ch'io n'arò la 'nformatione, in forma tale te la manderò scripta, ch'io credo mostrare a te et a qualunche altro la singularità dell'affectione gli portavo, come per experienza vedrai.
A' piacer tuoi. Che Christo di mal ti guardi.",1456,14
Giannozzo Manetti,Vespasiano da Bisticci,Napoli,"Honorevole come fratello et cetera. Quanto più considero le laudabili conditioni della mia charissima donna, tanto più mi duole averla perduta; et quanto maggiore affectione le portavo, tanto più cocente m'è la doglia della perdita; et quanto maggior danno ne riceve la mia famiglia, tanto più mi tormenta il cognoscere d'averla perduta. Et nientedimeno, perché questi casi sono naturali et non hanno altro rimedio che il sopportargli con patientia, m'ingegnerò di recarmi sotto questo giogho. Benché molto difficil sia chosì ne' principij, pure mi sforzerò di farlo, perché cognoscho che gli è gran vantaggio da farlo per tempo ad indugiarsi. Et una cosa è quella che, oltra l'altre, grandemente mi conforta: et questa è l'esser morta con optimo conoscimento et con virile animo infino al passare: che è gratia in que' casi da riconoscerla solo da Dio. Et il pigliarne presto partito farò, sì perché altro rimedio non c'è, sì etiandio per confortare per lo exemplo mio la brighata rimasa, et anchora invitato da' dolci et amichevoli conforti che per la tua de dì 21 mi dai, de' quali quanto più posso ti ringratio.

Et prieghoti che attenda un poco a confortare Agnolo, quando lo vedi. Et racchomandoti strettamente il mio Giovannino. Et a Pandolfo mi scuserai del non fare risposta alla sua, perché mi truovo in brighe et in occhupationi assai. Che attenda come gli pare alla emendatione di quella oratione funebre in quelle parti dove gli pare che n'abbi bisogno, ché alla sua discretione la rimetto. A' piacer tuoi. Che Christo di male ti guardi.",1457,15
Vespasiano da Bisticci,Piero de' Medici,Firenze,"Il Prinio e lla Decha sono di tutto finiti in buona forma, in modo credo vi piaceranno sommamente. Aregli arechati chostassù ma alla porta non mi arebbono lasciato venire. Mandate uno chon qualche panno da involgergli, che non si guastino. Meser Piero Strozi ha finite l'abreviationi e holle dato a Pipo <che> le minî, e subito si legaranno. Ad voi mi rachomando.",1458,19
Vespasiano da Bisticci,Jean Jouffroy,Firenze,"Reverende in Christo Pater et Domine, humili commendatione premissa et cetera.
Pauci sunt dies elapsi, quod ego dedi litteras Dominationi Vestre et illis significavi qualiter consignaveram Gerozo de Pillis quatuor volumina Commentariorum Sancti Jheronimi et in Novum et in Vetus Testamentum: que quidem maxima cum difficultate ut transcriberentur procuravi. Putabam ultra verum pretium consequi debere a Dominatione Vestra pro meo labore aliquid mercedis et dono; verum hoc non solum consecutus sum, attamen de vero pretio et capitali michi deest; et de hac re non ut debeo, sed ut possum sum contentus.
Feceram principiare Comentum Jheronimi super Isaiam et nunc est expletum. Si Dominatio Vestra illud vult quemadmodum in nota mihi tradita propria manu Dominationi Vestre scripta continetur - certiorari expecto. In illa enim nota continetur quod, preter Commentum super Ezechiele quod Dominatio Vestra dixit apud se habere, ego facerem alios super Scriptura Sancta inclusive super Veteri et Novo Testamento.
Restant preterea in manibus meis Jheronimus super Isaiam prefatus et super Matteo et Marcho; et de istis duobus pretium mihi adhuc solvi debet: de quibus oro Dominationem Vestram ut faciatis mihi fieri debitum, ad hoc ut possim de Dominatione Vestra bene mereri et eiusdem laudes referre, quemadmodum usque ad hec tempora contigit. Et si Dominatio Vestra vult residuum super Sancta Scriptura, paratus sum providere quod Dominatio Vestra habeat id quod nullus in Italia alter unquam habuit nec habet. In super rogo Dominationem Vestram quod provideat pro illo Eusebio Panfilo De preparatione Evangelica: nam, si illud vultis, habeo optimum et quam primum transmittam.
Ego me Dominationi Vestre plurimum recommitto.",1460,20
Donato Acciaiuoli,Vespasiano da Bisticci,Poppi,"Suscepi, una cum litteris tuis, Philippicas Ciceronis et De primo Bello Punico <et> Historiam Leonardi. Caroli nunc Vitam expecto et Emilium Probum aliosque itidem libros quos superioribus litteris nominavi. Cupio enim hoc meo semestri imperio non solum recte, ut debeo et ut plerique solent, magistratum gerere, sed etiam quod multi vellent, pauci possunt aliquid laude et <me>moria dignum conficere. Sed vereor ne occupationes curie et multa que in dies eveniunt inimica ocio et a litteris aliena, huic mee voluntati adversentur. Enitar tamen id parum temporis, quod mihi a negocijs et ab his molestijs supererit, ad scribendum precipue legendum conferre. Tu vero ne mihi instrumenta desint, pro tua in me benivolentia operam dabis, ut ceteri libri quibus indigeo ad nos quam primum deferantur. Vale.",1462,21
